{
  "image_id": "T01-B20261026B-I0049",
  "path": "tests/images/T01-baseline/B20261026B/T01-B20261026B-I0049.jpg",
  "sha256": "04b76434ae7c4b30492164b1bc518326837161e6b65dca358fd856d4ed19ae35",
  "runs": [
    {
      "run_id": "RB20261026B-v0",
      "variant": "29x29_12c_area_mard221_v0",
      "date": "2026-10-26",
      "verdict": "pass",
      "metrics": {
        "grid": [
          29,
          29
        ],
        "cells_total": 841,
        "colors_used": 12,
        "selected_codes": [
          "H2",
          "F8",
          "H6",
          "M7",
          "F24",
          "F9",
          "F11",
          "H4",
          "H7",
          "M12",
          "H8",
          "F19"
        ],
        "delta_e_p50": 0.50029902463151,
        "delta_e_p95": 8.34019455120205,
        "delta_e_max": 13.741879831557913,
        "beads_total": 932,
        "compute_ms": 221.4,
        "image_meta": {
          "orig_size": [
            900,
            1600
          ],
          "crop_size": [
            900,
            900
          ],
          "crop_box": [
            0,
            350,
            900,
            1250
          ]
        },
        "palette": "mard221.csv",
        "group": "正例",
        "type": "logo",
        "total_ms": 283.1,
        "csv_cells_total": 841,
        "pdf": {
          "page": "A4",
          "pages": 1,
          "page_mm": [
            210.0,
            297.0
          ],
          "grid": [
            29,
            29
          ],
          "cell_mm": 5.0,
          "ruler_mm": 10.0
        },
        "structural_failures": [],
        "files": {
          "preview": "T01-B20261026B-I0049/preview.png",
          "pdf": "T01-B20261026B-I0049/pattern.pdf",
          "csv": "T01-B20261026B-I0049/usage.csv"
        },
        "rating": 3
      },
      "failures": [
        "detail_lost"
      ],
      "comment": "T01 human rating: 3/5",
      "reviewer": "owner",
      "updated_at": "2026-10-26T05:58:58+08:00"
    }
  ]
}
