{
  "image_id": "T01-B20261026B-I0076",
  "path": "tests/images/T01-baseline/B20261026B/T01-B20261026B-I0076.jpg",
  "sha256": "bc6e9b14ab79024703d8898e4432e9b7712fea6ccf1cc45b1d460ac95b620183",
  "runs": [
    {
      "run_id": "RB20261026B-v0",
      "variant": "29x29_12c_area_mard221_v0",
      "date": "2026-10-26",
      "verdict": "fail",
      "metrics": {
        "grid": [
          29,
          29
        ],
        "cells_total": 841,
        "colors_used": 12,
        "selected_codes": [
          "G14",
          "G19",
          "H16",
          "M9",
          "G17",
          "G13",
          "G7",
          "H6",
          "A6",
          "A10",
          "F10",
          "F18"
        ],
        "delta_e_p50": 4.794459687746463,
        "delta_e_p95": 9.423109002550696,
        "delta_e_max": 17.67355654559049,
        "beads_total": 932,
        "compute_ms": 318.1,
        "image_meta": {
          "orig_size": [
            1080,
            1440
          ],
          "crop_size": [
            1080,
            1080
          ],
          "crop_box": [
            0,
            180,
            1080,
            1260
          ]
        },
        "palette": "mard221.csv",
        "group": "正例",
        "type": "scene",
        "total_ms": 385.8,
        "csv_cells_total": 841,
        "pdf": {
          "page": "A4",
          "pages": 1,
          "page_mm": [
            210.0,
            297.0
          ],
          "grid": [
            29,
            29
          ],
          "cell_mm": 5.0,
          "ruler_mm": 10.0
        },
        "structural_failures": [],
        "files": {
          "preview": "T01-B20261026B-I0076/preview.png",
          "pdf": "T01-B20261026B-I0076/pattern.pdf",
          "csv": "T01-B20261026B-I0076/usage.csv"
        },
        "rating": 1
      },
      "failures": [
        "detail_lost",
        "banding"
      ],
      "comment": "高光丢失",
      "reviewer": "owner",
      "updated_at": "2026-10-26T05:58:58+08:00"
    }
  ]
}
