{
  "image_id": "T01-B20261026B-I0007",
  "path": "tests/images/T01-baseline/B20261026B/T01-B20261026B-I0007.jpg",
  "sha256": "29f36c9272810ca8e75fb7c9653df651e578684d9a6592d652e8e4197c0475f2",
  "runs": [
    {
      "run_id": "RB20261026B-v0",
      "variant": "29x29_12c_area_mard221_v0",
      "date": "2026-10-26",
      "verdict": "pass",
      "metrics": {
        "grid": [
          29,
          29
        ],
        "cells_total": 841,
        "colors_used": 12,
        "selected_codes": [
          "C9",
          "G19",
          "B11",
          "F20",
          "D15",
          "E11",
          "G5",
          "D2",
          "A14",
          "C20",
          "A15",
          "F6"
        ],
        "delta_e_p50": 7.510751897061498,
        "delta_e_p95": 16.45958979012798,
        "delta_e_max": 25.59496553906168,
        "beads_total": 932,
        "compute_ms": 217.4,
        "image_meta": {
          "orig_size": [
            1069,
            1069
          ],
          "crop_size": [
            1069,
            1069
          ],
          "crop_box": [
            0,
            0,
            1069,
            1069
          ]
        },
        "palette": "mard221.csv",
        "group": "正例",
        "type": "cartoon",
        "total_ms": 278.9,
        "csv_cells_total": 841,
        "pdf": {
          "page": "A4",
          "pages": 1,
          "page_mm": [
            210.0,
            297.0
          ],
          "grid": [
            29,
            29
          ],
          "cell_mm": 5.0,
          "ruler_mm": 10.0
        },
        "structural_failures": [],
        "files": {
          "preview": "T01-B20261026B-I0007/preview.png",
          "pdf": "T01-B20261026B-I0007/pattern.pdf",
          "csv": "T01-B20261026B-I0007/usage.csv"
        },
        "rating": 3
      },
      "failures": [
        "island_noise",
        "outline_blur",
        "detail_lost",
        "banding"
      ],
      "comment": "背景和主题颜色融合",
      "reviewer": "owner",
      "updated_at": "2026-10-26T05:58:58+08:00"
    }
  ]
}
