{
  "image_id": "T01-B20261026B-I0082",
  "path": "tests/images/T01-baseline/B20261026B/T01-B20261026B-I0082.jpg",
  "sha256": "66c05fc3b412e06b78ac505839f34272528028656abe82c0b915b8add6f5fbd6",
  "runs": [
    {
      "run_id": "RB20261026B-v0",
      "variant": "29x29_12c_area_mard221_v0",
      "date": "2026-10-26",
      "verdict": "pass",
      "metrics": {
        "grid": [
          29,
          29
        ],
        "cells_total": 841,
        "colors_used": 12,
        "selected_codes": [
          "C20",
          "M7",
          "H5",
          "C6",
          "M15",
          "C16",
          "H7",
          "H8",
          "C7",
          "C18",
          "H20",
          "H4"
        ],
        "delta_e_p50": 6.252057267525042,
        "delta_e_p95": 9.654117860112546,
        "delta_e_max": 18.62331384355621,
        "beads_total": 931,
        "compute_ms": 227.5,
        "image_meta": {
          "orig_size": [
            1080,
            1440
          ],
          "crop_size": [
            1080,
            1080
          ],
          "crop_box": [
            0,
            180,
            1080,
            1260
          ]
        },
        "palette": "mard221.csv",
        "group": "正例",
        "type": "scene",
        "total_ms": 284.1,
        "csv_cells_total": 841,
        "pdf": {
          "page": "A4",
          "pages": 1,
          "page_mm": [
            210.0,
            297.0
          ],
          "grid": [
            29,
            29
          ],
          "cell_mm": 5.0,
          "ruler_mm": 10.0
        },
        "structural_failures": [],
        "files": {
          "preview": "T01-B20261026B-I0082/preview.png",
          "pdf": "T01-B20261026B-I0082/pattern.pdf",
          "csv": "T01-B20261026B-I0082/usage.csv"
        },
        "rating": 4
      },
      "failures": [
        "color_shift"
      ],
      "comment": "T01 human rating: 4/5",
      "reviewer": "owner",
      "updated_at": "2026-10-26T05:58:58+08:00"
    }
  ]
}
