{
  "image_id": "T00-B20261026A-I0002",
  "path": "tests/images/T00-smoke/B20261026A/T00-B20261026A-I0002.png",
  "sha256": "621efb599df340d5b3d9eed62754b041b9412d1d87e0deea14306f4775fd67db",
  "runs": [
    {
      "run_id": "RB20261026A-v0",
      "variant": "29x29_12c_area_mard221_v0",
      "date": "2026-10-26",
      "verdict": "pass",
      "metrics": {
        "grid": [
          29,
          29
        ],
        "cells_total": 841,
        "colors_used": 12,
        "selected_codes": [
          "H2",
          "D22",
          "D9",
          "D10",
          "D7",
          "H1",
          "D16",
          "H5",
          "H13",
          "B21",
          "D6",
          "H23"
        ],
        "delta_e_p50": 3.2781752457836157,
        "delta_e_p95": 10.371733374313058,
        "delta_e_max": 20.806610671014514,
        "beads_total": 930,
        "compute_ms": 196.2,
        "image_meta": {
          "orig_size": [
            128,
            128
          ],
          "crop_size": [
            128,
            128
          ],
          "crop_box": [
            0,
            0,
            128,
            128
          ]
        },
        "palette": "mard221.csv",
        "total_ms": 243.0,
        "csv_cells_total": 841,
        "pdf": {
          "page": "A4",
          "pages": 1,
          "page_mm": [
            210.0,
            297.0
          ],
          "grid": [
            29,
            29
          ],
          "cell_mm": 5.0,
          "ruler_mm": 10.0
        },
        "files": {
          "preview": "T00-B20261026A-I0002/preview.png",
          "pdf": "T00-B20261026A-I0002/pattern.pdf",
          "csv": "T00-B20261026A-I0002/usage.csv"
        }
      },
      "failures": [],
      "comment": "T00 structural smoke; no aesthetic rating.",
      "reviewer": "zcode",
      "updated_at": "2026-10-26T02:41:39+08:00"
    }
  ]
}
