{
  "image_id": "T01-B20261026B-I0097",
  "path": "tests/images/T01-baseline/B20261026B/T01-B20261026B-I0097.jpg",
  "sha256": "68f03751588100540f588b481e3a4d33a90969df6a8a605f0161d738d97aa817",
  "runs": [
    {
      "run_id": "RB20261026B-v0",
      "variant": "29x29_12c_area_mard221_v0",
      "date": "2026-10-26",
      "verdict": "fail",
      "metrics": {
        "grid": [
          29,
          29
        ],
        "cells_total": 841,
        "colors_used": 12,
        "selected_codes": [
          "H4",
          "H9",
          "H5",
          "H20",
          "H6",
          "H2",
          "H11",
          "M15",
          "H7",
          "H3",
          "H23",
          "H16"
        ],
        "delta_e_p50": 5.188032703976754,
        "delta_e_p95": 8.382500722861629,
        "delta_e_max": 10.82084033108437,
        "beads_total": 931,
        "compute_ms": 247.5,
        "image_meta": {
          "orig_size": [
            218,
            223
          ],
          "crop_size": [
            218,
            218
          ],
          "crop_box": [
            0,
            2,
            218,
            220
          ]
        },
        "palette": "mard221.csv",
        "group": "硬负例",
        "type": "hard_negative",
        "total_ms": 328.8,
        "csv_cells_total": 841,
        "pdf": {
          "page": "A4",
          "pages": 1,
          "page_mm": [
            210.0,
            297.0
          ],
          "grid": [
            29,
            29
          ],
          "cell_mm": 5.0,
          "ruler_mm": 10.0
        },
        "structural_failures": [],
        "files": {
          "preview": "T01-B20261026B-I0097/preview.png",
          "pdf": "T01-B20261026B-I0097/pattern.pdf",
          "csv": "T01-B20261026B-I0097/usage.csv"
        },
        "rating": 1
      },
      "failures": [
        "detail_lost"
      ],
      "comment": "T01 human rating: 1/5",
      "reviewer": "owner",
      "updated_at": "2026-10-26T05:58:58+08:00"
    }
  ]
}
