{
  "image_id": "T01-B20261026B-I0001",
  "path": "tests/images/T01-baseline/B20261026B/T01-B20261026B-I0001.jpg",
  "sha256": "1a716c927222ae322d78583b79de4ecdaa53ff6689d9fcbccfa8d5d9d06396fd",
  "runs": [
    {
      "run_id": "RB20261026B-v0",
      "variant": "29x29_12c_area_mard221_v0",
      "date": "2026-10-26",
      "verdict": "fail",
      "metrics": {
        "grid": [
          29,
          29
        ],
        "cells_total": 841,
        "colors_used": 12,
        "selected_codes": [
          "H2",
          "E22",
          "H3",
          "E19",
          "M12",
          "A9",
          "H4",
          "H9",
          "G13",
          "E23",
          "B32",
          "E1"
        ],
        "delta_e_p50": 0.657108121140762,
        "delta_e_p95": 10.477777206807414,
        "delta_e_max": 20.71148377520996,
        "beads_total": 929,
        "compute_ms": 356.2,
        "image_meta": {
          "orig_size": [
            960,
            960
          ],
          "crop_size": [
            960,
            960
          ],
          "crop_box": [
            0,
            0,
            960,
            960
          ]
        },
        "palette": "mard221.csv",
        "group": "正例",
        "type": "cartoon",
        "total_ms": 440.8,
        "csv_cells_total": 841,
        "pdf": {
          "page": "A4",
          "pages": 1,
          "page_mm": [
            210.0,
            297.0
          ],
          "grid": [
            29,
            29
          ],
          "cell_mm": 5.0,
          "ruler_mm": 10.0
        },
        "structural_failures": [],
        "files": {
          "preview": "T01-B20261026B-I0001/preview.png",
          "pdf": "T01-B20261026B-I0001/pattern.pdf",
          "csv": "T01-B20261026B-I0001/usage.csv"
        },
        "rating": 2
      },
      "failures": [
        "eye_lost",
        "outline_blur",
        "detail_lost",
        "thin_line_lost"
      ],
      "comment": "轮廓及线稿分界明显偏灰、关键特征全部模糊丢失，",
      "reviewer": "owner",
      "updated_at": "2026-10-26T05:58:58+08:00"
    }
  ]
}
