{
  "image_id": "T01-B20261026B-I0030",
  "path": "tests/images/T01-baseline/B20261026B/T01-B20261026B-I0030.jpg",
  "sha256": "533ed56b498e13d079a9cb10ba11de263d32196f2dbc556fd48311e187d91947",
  "runs": [
    {
      "run_id": "RB20261026B-v0",
      "variant": "29x29_12c_area_mard221_v0",
      "date": "2026-10-26",
      "verdict": "fail",
      "metrics": {
        "grid": [
          29,
          29
        ],
        "cells_total": 841,
        "colors_used": 12,
        "selected_codes": [
          "H3",
          "H6",
          "E23",
          "D11",
          "H7",
          "E21",
          "H5",
          "M12",
          "M8",
          "M10",
          "D7",
          "H4"
        ],
        "delta_e_p50": 4.8849507451277105,
        "delta_e_p95": 9.436691839594177,
        "delta_e_max": 16.297442170453394,
        "beads_total": 930,
        "compute_ms": 240.5,
        "image_meta": {
          "orig_size": [
            1434,
            1080
          ],
          "crop_size": [
            1080,
            1080
          ],
          "crop_box": [
            177,
            0,
            1257,
            1080
          ]
        },
        "palette": "mard221.csv",
        "group": "正例",
        "type": "portrait",
        "total_ms": 298.5,
        "csv_cells_total": 841,
        "pdf": {
          "page": "A4",
          "pages": 1,
          "page_mm": [
            210.0,
            297.0
          ],
          "grid": [
            29,
            29
          ],
          "cell_mm": 5.0,
          "ruler_mm": 10.0
        },
        "structural_failures": [],
        "files": {
          "preview": "T01-B20261026B-I0030/preview.png",
          "pdf": "T01-B20261026B-I0030/pattern.pdf",
          "csv": "T01-B20261026B-I0030/usage.csv"
        },
        "rating": 1
      },
      "failures": [
        "detail_lost",
        "skin_shift",
        "color_shift",
        "eye_lost"
      ],
      "comment": "尺寸小了",
      "reviewer": "owner",
      "updated_at": "2026-10-26T05:58:58+08:00"
    }
  ]
}
