{
  "image_id": "T01-B20261026B-I0025",
  "path": "tests/images/T01-baseline/B20261026B/T01-B20261026B-I0025.jpg",
  "sha256": "aeb7b5587a2d13bbdc208596dc63fc36ea9233aa99e76aa1067f4dd138da9ee7",
  "runs": [
    {
      "run_id": "RB20261026B-v0",
      "variant": "29x29_12c_area_mard221_v0",
      "date": "2026-10-26",
      "verdict": "fail",
      "metrics": {
        "grid": [
          29,
          29
        ],
        "cells_total": 841,
        "colors_used": 12,
        "selected_codes": [
          "H20",
          "D4",
          "H2",
          "M8",
          "C12",
          "C29",
          "D16",
          "D2",
          "H6",
          "G17",
          "D11",
          "E21"
        ],
        "delta_e_p50": 3.920277367676706,
        "delta_e_p95": 11.082951437183816,
        "delta_e_max": 17.433265021952298,
        "beads_total": 931,
        "compute_ms": 294.8,
        "image_meta": {
          "orig_size": [
            1256,
            1052
          ],
          "crop_size": [
            1052,
            1052
          ],
          "crop_box": [
            102,
            0,
            1154,
            1052
          ]
        },
        "palette": "mard221.csv",
        "group": "正例",
        "type": "portrait",
        "total_ms": 360.6,
        "csv_cells_total": 841,
        "pdf": {
          "page": "A4",
          "pages": 1,
          "page_mm": [
            210.0,
            297.0
          ],
          "grid": [
            29,
            29
          ],
          "cell_mm": 5.0,
          "ruler_mm": 10.0
        },
        "structural_failures": [],
        "files": {
          "preview": "T01-B20261026B-I0025/preview.png",
          "pdf": "T01-B20261026B-I0025/pattern.pdf",
          "csv": "T01-B20261026B-I0025/usage.csv"
        },
        "rating": 1
      },
      "failures": [
        "detail_lost",
        "eye_lost",
        "thin_line_lost",
        "skin_shift"
      ],
      "comment": "T01 human rating: 1/5",
      "reviewer": "owner",
      "updated_at": "2026-10-26T05:58:58+08:00"
    }
  ]
}
