{
  "image_id": "T01-B20261026B-I0043",
  "path": "tests/images/T01-baseline/B20261026B/T01-B20261026B-I0043.jpg",
  "sha256": "fc17d6a229ec9daebb6f25f13a522c8441046e896bfa1db90fcdee2ee0852454",
  "runs": [
    {
      "run_id": "RB20261026B-v0",
      "variant": "29x29_12c_area_mard221_v0",
      "date": "2026-10-26",
      "verdict": "fail",
      "metrics": {
        "grid": [
          29,
          29
        ],
        "cells_total": 841,
        "colors_used": 12,
        "selected_codes": [
          "G14",
          "H7",
          "G4",
          "M9",
          "H16",
          "A5",
          "G11",
          "G17",
          "B26",
          "G21",
          "G5",
          "F10"
        ],
        "delta_e_p50": 5.051381438181561,
        "delta_e_p95": 12.8111978864356,
        "delta_e_max": 20.18807279939584,
        "beads_total": 930,
        "compute_ms": 250.5,
        "image_meta": {
          "orig_size": [
            1080,
            1440
          ],
          "crop_size": [
            1080,
            1080
          ],
          "crop_box": [
            0,
            180,
            1080,
            1260
          ]
        },
        "palette": "mard221.csv",
        "group": "正例",
        "type": "pet",
        "total_ms": 327.4,
        "csv_cells_total": 841,
        "pdf": {
          "page": "A4",
          "pages": 1,
          "page_mm": [
            210.0,
            297.0
          ],
          "grid": [
            29,
            29
          ],
          "cell_mm": 5.0,
          "ruler_mm": 10.0
        },
        "structural_failures": [],
        "files": {
          "preview": "T01-B20261026B-I0043/preview.png",
          "pdf": "T01-B20261026B-I0043/pattern.pdf",
          "csv": "T01-B20261026B-I0043/usage.csv"
        },
        "rating": 1
      },
      "failures": [
        "detail_lost",
        "eye_lost",
        "outline_blur"
      ],
      "comment": "轮廓非常糊，关键细节丢失",
      "reviewer": "owner",
      "updated_at": "2026-10-26T05:58:58+08:00"
    }
  ]
}
