{
  "image_id": "T01-B20261026B-I0041",
  "path": "tests/images/T01-baseline/B20261026B/T01-B20261026B-I0041.jpg",
  "sha256": "8a417b5a1f72f934b188299d300bc56e0bc451dd78f2b88d81f1332c21a70a15",
  "runs": [
    {
      "run_id": "RB20261026B-v0",
      "variant": "29x29_12c_area_mard221_v0",
      "date": "2026-10-26",
      "verdict": "fail",
      "metrics": {
        "grid": [
          29,
          29
        ],
        "cells_total": 841,
        "colors_used": 12,
        "selected_codes": [
          "M1",
          "M15",
          "M7",
          "H14",
          "H5",
          "M9",
          "M6",
          "M4",
          "F20",
          "H23",
          "H11",
          "G4"
        ],
        "delta_e_p50": 4.884829439460679,
        "delta_e_p95": 11.059306967160978,
        "delta_e_max": 18.44884390239813,
        "beads_total": 931,
        "compute_ms": 230.3,
        "image_meta": {
          "orig_size": [
            828,
            1600
          ],
          "crop_size": [
            828,
            828
          ],
          "crop_box": [
            0,
            386,
            828,
            1214
          ]
        },
        "palette": "mard221.csv",
        "group": "正例",
        "type": "pet",
        "total_ms": 288.2,
        "csv_cells_total": 841,
        "pdf": {
          "page": "A4",
          "pages": 1,
          "page_mm": [
            210.0,
            297.0
          ],
          "grid": [
            29,
            29
          ],
          "cell_mm": 5.0,
          "ruler_mm": 10.0
        },
        "structural_failures": [],
        "files": {
          "preview": "T01-B20261026B-I0041/preview.png",
          "pdf": "T01-B20261026B-I0041/pattern.pdf",
          "csv": "T01-B20261026B-I0041/usage.csv"
        },
        "rating": 1
      },
      "failures": [
        "detail_lost",
        "thin_line_lost",
        "background_clutter"
      ],
      "comment": "T01 human rating: 1/5",
      "reviewer": "owner",
      "updated_at": "2026-10-26T05:58:58+08:00"
    }
  ]
}
